{
    "$id": "https://ssb.no/schemas/ssb-poc-statlog-model/change-data-log/3.0.0",
    "$schema": "https://json-schema.org/draft/2020-12/schema",
    "title": "Change data log",
    "description": "Data model for data change log in a statistical production process.",
    "type": "object",
    "additionalProperties": false,
    "properties": {
        "schema_version": {
            "description": "Version of this schema.",
            "type": "string",
            "const": "3.0.0"
        },
        "event_id": {"description": "Stable identifier of this persisted change event.", "type": ["string", "null"], "minLength": 1, "default": null},
        "segment_id": {"description": "Identifier linking this change to its transformation's lineage.", "type": ["string", "null"], "minLength": 1, "default": null},
        "recorded_at": {"description": "Timezone-aware instant when this event was recorded, distinct from change_datetime.", "type": ["string", "null"], "format": "date-time", "default": null},
        "gsbpm_code": {"description": "Optional GSBPM code from Klass classification 933.", "type": ["string", "null"], "pattern": "^[1-8](?:\\.[0-9]+)*$", "default": null},
        "producer_metadata": {"description": "Team-defined JSON-compatible production details; cannot override named fields.", "type": ["object", "null"], "additionalProperties": true, "default": null},
        "statistics_name": {
            "description": "Statistics shortname or statistics product name",
            "type": "string"
        },
        "data_source": {
            "description": "Input GCS paths with generations or inline partition members used before changing data.",
            "$comment": "Dataset filepath (eg. GCS-path to a parquet file).",
            "type": "array",
            "items": {
                "$ref": "lineage-json-schema.json#/$defs/dataset"
            }
        },
        "data_target": {
            "description": "Target dataset filepath (eg. GCS-path to a parquet file).",
            "$comment": "Location for target dataset (where data is stored after changes have been made).",
            "type": "string"
        },
        "data_period": {
            "description": "Data period for changed data - eg. a year, quarter, month, day (date), ...",
            "type": "string"
        },
        "change_event": {
            "description": "How the event was triggered: Automatically changed (A), Manually changed (M), Manually approved with no change (MNC), Not reviewed (NOT).",
            "type": "string",
            "enum": [
                "A",
                "M",
                "MNC",
                "NOT"
            ]
        },
        "change_event_reason": {
            "description": "Reason for change or approval: Other source (OTHER_SOURCE), Statistical review (REVIEW), Information from the data provider/registry owner (OWNER), Small/marginal unit (MARGINAL_UNIT), Data duplicate (DUPLICATE), Other reason (OTHER).",
            "type": "string",
            "enum": [
                "OTHER_SOURCE",
                "REVIEW",
                "OWNER",
                "MARGINAL_UNIT",
                "DUPLICATE",
                "OTHER"
            ]
        },
        "change_datetime": {
            "type": "string",
            "format": "date-time",
            "description": "Timestamp (date and time, ISO 8601) of an event or change"
        },
        "changed_by": {
            "type": "string",
            "description": "If manually (M): user name of the person who triggered an event; if automatically (A) name of method, function and/or process."
        },
        "data_change_type": {
            "description": "Data change type: Updated value (UPD), created new unit/row (NEW), or deleted unit/row (DEL).",
            "type": "string",
            "enum": [
                "NEW",
                "UPD",
                "DEL"
            ]
        },
        "change_comment": {
            "description": "Change comment",
            "type": "string"
        },
        "change_details": {
            "description": "Detailed information about the change. Either a unit-id, old and new value if one row (unit) was affected, or number of rows affected if the process changed multiple rows (units).",
            "discriminator": {
                "propertyName": "detail_type",
                "mapping": {
                    "rows": "#/properties/change_details/oneOf/0",
                    "unit": "#/properties/change_details/oneOf/1"
                }
            },
            "oneOf": [
                {
                    "type": "object",
                    "properties": {
                        "detail_type": {
                            "description": "Discriminator for change_details variant",
                            "const": "rows"
                        },
                        "rows_affected": {
                            "description": "Number of rows affected if the process changed multiple rows (units).",
                            "type": "integer"
                        },
                        "variable_name": {
                            "description": "The variable name (or element-path) that contains data changes.",
                            "$comment": "The variable short name (eg. 'income' or 'address') or element path for hierarchical data (eg. 'person.address.street' or 'person.income')",
                            "type": "string"
                        }
                    },
                    "required": ["detail_type", "rows_affected", "variable_name"],
                    "additionalProperties": false
                },
                {
                    "type": "object",
                    "properties": {
                        "detail_type": {
                            "description": "Discriminator for change_details variant",
                            "const": "unit"
                        },
                        "unit_id": {
                            "description": "One or more unit-identifier variables and values (primary key) if one row (unit) was affected, eg. 'fnr'='311280nnnnn' and 'orgnr'='123456789'.",
                            "type": "array",
                            "items": {
                                "type": "object",
                                "properties": {
                                    "unit_id_variable": {
                                        "description": "The unit-id variable name, e.g. 'fnr', 'pers_id', 'reg_nr' or 'komm_nr'.",
                                        "type": "string"
                                    },
                                    "unit_id_value": {
                                        "description": "The unit-id value, e.g. '311280nnnnn' or '123456789'.",
                                        "type": "string"
                                    }
                                },
                                "required": ["unit_id_variable", "unit_id_value"],
                                "additionalProperties": false
                            }
                        },
                        "old_value": {
                            "description": "Old value(s). If delete (data_change_type = DEL) - log all deleted variable-values from the deleted data row/record, eg. 'income'='1000', 'address'='Street 123', ...",
                            "items": {
                                "type": "object",
                                "properties": {
                                    "variable_name": {"type": "string"},
                                    "value": {"type": "string"}
                                },
                                "required": ["variable_name", "value"],
                                "additionalProperties": false
                            }
                        },
                        "new_value": {
                            "description": "New value(s). If insert (data_change_type = INS) - log all inserted variable-values in the data row/record, eg. 'income'='1000', 'address'='Street 123', ...",
                            "type": "array",
                            "items": {
                                "type": "object",
                                "properties": {
                                    "variable_name": {"type": "string"},
                                    "value": {"type": "string"}
                                },
                                "required": ["variable_name", "value"],
                                "additionalProperties": false
                            }
                        }
                    },
                    "required": ["detail_type", "unit_id"],
                    "additionalProperties": false
                }
            ]
        }
    },
    "required": [
        "schema_version",
        "statistics_name",
        "data_source",
        "data_target",
        "data_period",
        "change_event",
        "change_datetime",
        "changed_by",
        "change_details"
    ]
}
