{
    "schema_version":  "3.0.0",
    "statistics_name":  "arblonn",
    "data_source":  [
                        {
                            "path":  "gs://ssb-prod-superteam-data-produkt/arblonn/inndata/arbeidloenn_p2023-11_v1.parquet"
                        },
                        {
                            "path":  "gs://ssb-prod-superteam-data-produkt/arblonn/inndata/arbeidloenn_p2023-12_v1.parquet"
                        }
                    ],
    "data_target":  "gs://ssb-prod-superteam-data-produkt/arblonn/klargjorte-data/arbeidloenn_p2023-12_v1.parquet",
    "data_period":  "2023-12",
    "change_event":  "A",
    "change_event_reason":  "OTHER_SOURCE",
    "change_datetime":  "2024-01-10T15:00:00.000Z",
    "changed_by":  "arblonn_automagisk_metode.py",
    "data_change_type":  "NEW",
    "change_comment":  "Opprettet ny enhet (person) fra ny datakilde ...",
    "change_details":  {
                           "detail_type":  "unit",
                           "unit_id":  [
                                           {
                                               "unit_id_variable":  "fnr",
                                               "unit_id_value":  "170598nnnnn"
                                           },
                                           {
                                               "unit_id_variable":  "orgnr",
                                               "unit_id_value":  "123456789"
                                           }
                                       ],
                           "old_value":  null,
                           "new_value":  [
                                             {
                                                 "variable_name":  "bostedskommune",
                                                 "value":  "0101"
                                             },
                                             {
                                                 "variable_name":  "type_loenn",
                                                 "value":  "time"
                                             },
                                             {
                                                 "variable_name":  "loenn",
                                                 "value":  "38000"
                                             },
                                             {
                                                 "variable_name":  "overtid_loenn",
                                                 "value":  "3000"
                                             }
                                         ]
                       }
}
