{
  "schema_version": "3.0.0",
  "event_id": "example-change-1",
  "segment_id": "example-segment-1",
  "recorded_at": "2024-01-10T15:00:00Z",
  "statistics_name": "arblonn",
  "data_source": [
    {
      "path": "gs://ssb-prod-superteam-data-produkt/arblonn/inndata/arbeidloenn_p2023-12_v1.parquet",
      "generation": "1760000000000001"
    }
  ],
  "data_target": "gs://ssb-prod-superteam-data-produkt/arblonn/klargjorte-data/arbeidloenn_p2023-12_v1.parquet",
  "data_period": "2023-12",
  "change_event": "A",
  "change_event_reason": "OTHER_SOURCE",
  "change_datetime": "2024-01-10T15:00:00Z",
  "changed_by": "user@example.com",
  "data_change_type": "NEW",
  "change_comment": "Opprettet ny enhet (person) fra ny datakilde ...",
  "change_details": {
    "detail_type": "unit",
    "unit_id": [
      {
        "unit_id_variable": "fnr",
        "unit_id_value": "170598nnnnn"
      },
      {
        "unit_id_variable": "orgnr",
        "unit_id_value": "123456789"
      }
    ],
    "new_value": [
      {
        "variable_name": "bostedskommune",
        "value": "0101"
      },
      {
        "variable_name": "type_loenn",
        "value": "time"
      },
      {
        "variable_name": "loenn",
        "value": "38000"
      },
      {
        "variable_name": "overtid_loenn",
        "value": "3000"
      }
    ]
  }
}